{
 "$schema": "https://json-schema.org/draft/2020-12/schema",
 "$id": "https://solar-studio.invalid/schemas/solar.terrain.surface/1",
 "title": "solar.terrain.surface/1 (DRAFT for review)",
 "description": "A triangulated ground surface (TIN) in the same metric Cartesian frame as a Module 01 layout, with an explicit vertical reference. Structural checks only; semantic rules (counter-clockwise triangles, no plan overlap, no duplicate plan vertices, positive triangle area, limits) are listed in CONTRACTS.md section 2 and enforced by the validator.",
 "type": "object",
 "additionalProperties": false,
 "required": ["schema_version", "frame", "vertical", "vertices_xyz_m", "triangles"],
 "properties": {
  "schema_version": {"const": "solar.terrain.surface/1"},
  "name": {"type": "string", "maxLength": 200},
  "frame": {
   "description": "Identical object to the Module 01 request frame. Terrain and layout frames must be equal; no horizontal transformation is performed.",
   "type": "object",
   "additionalProperties": false,
   "required": ["kind", "id", "units", "axes"],
   "properties": {
    "kind": {"enum": ["local_cartesian", "projected_cartesian"]},
    "id": {"type": "string", "minLength": 1, "maxLength": 200},
    "crs": {"type": ["string", "null"], "maxLength": 200},
    "units": {"const": "m"},
    "axes": {
     "type": "object",
     "additionalProperties": false,
     "required": ["x", "y"],
     "properties": {"x": {"const": "east"}, "y": {"const": "north"}}
    }
   }
  },
  "vertical": {
   "description": "Vertical reference of every z value. Required; there is no default and no transformation between vertical references.",
   "type": "object",
   "additionalProperties": false,
   "required": ["kind", "units", "positive"],
   "properties": {
    "kind": {"enum": ["orthometric", "ellipsoidal", "local"]},
    "crs": {"type": ["string", "null"], "description": "Vertical CRS identifier (e.g. EPSG:5773) for orthometric/ellipsoidal heights; null for a local datum."},
    "id": {"type": "string", "description": "Identifier of a local benchmark datum; required when kind = local."},
    "units": {"const": "m"},
    "positive": {"const": "up"}
   },
   "allOf": [
    {"if": {"properties": {"kind": {"const": "local"}}}, "then": {"required": ["id"]}},
    {"if": {"properties": {"kind": {"enum": ["orthometric", "ellipsoidal"]}}}, "then": {"required": ["crs"], "properties": {"crs": {"type": "string", "minLength": 1}}}}
   ]
  },
  "source": {
   "type": "object",
   "properties": {
    "kind": {"enum": ["survey_tin", "synthetic_analytic", "dem_derived", "landxml_import"]},
    "description": {"type": "string"},
    "surveyed_on": {"type": "string"},
    "provider": {"type": "string"}
   }
  },
  "vertices_xyz_m": {
   "type": "array",
   "minItems": 3,
   "items": {"type": "array", "minItems": 3, "maxItems": 3, "items": {"type": "number"}}
  },
  "triangles": {
   "description": "Vertex index triples, counter-clockwise in plan. Coverage is exactly the closed union of these triangles; there is no implicit triangulation.",
   "type": "array",
   "minItems": 1,
   "items": {"type": "array", "minItems": 3, "maxItems": 3, "items": {"type": "integer", "minimum": 0}}
  }
 }
}
