{
 "schema_version": "solar.terrain.surface/1",
 "name": "Flat survey with a 0.000001 m wide unsurveyed strip",
 "frame": {
  "kind": "local_cartesian",
  "id": "local:analytic-site",
  "units": "m",
  "axes": {
   "x": "east",
   "y": "north"
  }
 },
 "vertical": {
  "kind": "local",
  "id": "local:fixture-datum",
  "crs": null,
  "units": "m",
  "positive": "up"
 },
 "source": {
  "kind": "synthetic_analytic",
  "description": "Two flat rectangles [0,4] x [0,8] and [4.000001,8] x [0,8] at z = 10; the strip between them is not surveyed"
 },
 "vertices_xyz_m": [
  [
   0.0,
   0.0,
   10.0
  ],
  [
   4.0,
   0.0,
   10.0
  ],
  [
   4.0,
   8.0,
   10.0
  ],
  [
   0.0,
   8.0,
   10.0
  ],
  [
   4.000001,
   0.0,
   10.0
  ],
  [
   8.0,
   0.0,
   10.0
  ],
  [
   8.0,
   8.0,
   10.0
  ],
  [
   4.000001,
   8.0,
   10.0
  ]
 ],
 "triangles": [
  [
   0,
   1,
   2
  ],
  [
   0,
   2,
   3
  ],
  [
   4,
   5,
   6
  ],
  [
   4,
   6,
   7
  ]
 ]
}
