{
 "schema_version": "solar.terrain.surface/1",
 "name": "Steep plane G = 20 + 0.6 y",
 "frame": {
  "kind": "local_cartesian",
  "id": "local:analytic-site",
  "units": "m",
  "axes": {
   "x": "east",
   "y": "north"
  }
 },
 "vertical": {
  "kind": "local",
  "id": "local:fixture-datum",
  "crs": null,
  "units": "m",
  "positive": "up"
 },
 "source": {
  "kind": "synthetic_analytic",
  "description": "Two triangles over [0,8] x [0,8]; G = 20 + 0.6 y (about 31 degrees)"
 },
 "vertices_xyz_m": [
  [
   0.0,
   0.0,
   20.0
  ],
  [
   8.0,
   0.0,
   20.0
  ],
  [
   8.0,
   8.0,
   24.8
  ],
  [
   0.0,
   8.0,
   24.8
  ]
 ],
 "triangles": [
  [
   0,
   1,
   2
  ],
  [
   0,
   2,
   3
  ]
 ]
}
