{
 "schema_version": "solar.terrain.surface/1",
 "name": "Plane G = 100 + 0.05 x + 0.10 y over the rectangle site",
 "frame": {
  "kind": "local_cartesian",
  "id": "local:analytic-site",
  "units": "m",
  "axes": {
   "x": "east",
   "y": "north"
  }
 },
 "vertical": {
  "kind": "local",
  "id": "local:fixture-datum",
  "crs": null,
  "units": "m",
  "positive": "up"
 },
 "source": {
  "kind": "synthetic_analytic",
  "description": "Two triangles over [0,12] x [0,14]; G(x, y) = 100 + 0.05 x + 0.10 y"
 },
 "vertices_xyz_m": [
  [
   0.0,
   0.0,
   100.0
  ],
  [
   12.0,
   0.0,
   100.6
  ],
  [
   12.0,
   14.0,
   102.0
  ],
  [
   0.0,
   14.0,
   101.4
  ]
 ],
 "triangles": [
  [
   0,
   1,
   2
  ],
  [
   0,
   2,
   3
  ]
 ]
}
