{
 "schema_version": "solar.terrain.surface/1",
 "name": "Fan with a raised centre vertex",
 "frame": {
  "kind": "local_cartesian",
  "id": "local:analytic-site",
  "units": "m",
  "axes": {
   "x": "east",
   "y": "north"
  }
 },
 "vertical": {
  "kind": "local",
  "id": "local:fixture-datum",
  "crs": null,
  "units": "m",
  "positive": "up"
 },
 "source": {
  "kind": "synthetic_analytic",
  "description": "Square [0,8]^2 at z = 10 with one interior vertex (4, 4, 10.6); four triangles, CCW"
 },
 "vertices_xyz_m": [
  [
   0.0,
   0.0,
   10.0
  ],
  [
   8.0,
   0.0,
   10.0
  ],
  [
   8.0,
   8.0,
   10.0
  ],
  [
   0.0,
   8.0,
   10.0
  ],
  [
   4.0,
   4.0,
   10.6
  ]
 ],
 "triangles": [
  [
   0,
   1,
   4
  ],
  [
   1,
   2,
   4
  ],
  [
   2,
   3,
   4
  ],
  [
   3,
   0,
   4
  ]
 ]
}
