{
 "schema_version": "solar.terrain.surface/1",
 "name": "Hill fan with a consistent T-junction",
 "frame": {
  "kind": "local_cartesian",
  "id": "local:analytic-site",
  "units": "m",
  "axes": {
   "x": "east",
   "y": "north"
  }
 },
 "vertical": {
  "kind": "local",
  "id": "local:fixture-datum",
  "crs": null,
  "units": "m",
  "positive": "up"
 },
 "source": {
  "kind": "synthetic_analytic",
  "description": "hill-fan with vertex (6, 2, 10.3) on edge (8,0)-(4,4); triangle [1,2,4] split into [1,2,5] and [5,2,4]; [0,1,4] keeps the full edge. 10.3 is the edge's interpolated elevation"
 },
 "vertices_xyz_m": [
  [
   0.0,
   0.0,
   10.0
  ],
  [
   8.0,
   0.0,
   10.0
  ],
  [
   8.0,
   8.0,
   10.0
  ],
  [
   0.0,
   8.0,
   10.0
  ],
  [
   4.0,
   4.0,
   10.6
  ],
  [
   6.0,
   2.0,
   10.3
  ]
 ],
 "triangles": [
  [
   0,
   1,
   4
  ],
  [
   1,
   2,
   5
  ],
  [
   5,
   2,
   4
  ],
  [
   2,
   3,
   4
  ],
  [
   3,
   0,
   4
  ]
 ]
}
